{
  "$schema": "http://json-schema.org/draft-07/schema#",
  "title": "Class Attribute Bonuses Schema",
  "description": "Schema for validating class attribute bonuses data",
  "type": "object",
  "additionalProperties": {
    "type": "object",
    "description": "Attribute bonuses for a specific class",
    "additionalProperties": {
      "type": "integer"
    }
  },
  "properties": {
    "Power Control": {
      "type": "object",
      "description": "Attribute bonuses for Power Control class",
      "additionalProperties": {
        "type": "integer"
      }
    },
    "History of Powers": {
      "type": "object",
      "description": "Attribute bonuses for History of Powers class",
      "additionalProperties": {
        "type": "integer"
      }
    },
    "Combat Training": {
      "type": "object",
      "description": "Attribute bonuses for Combat Training class",
      "additionalProperties": {
        "type": "integer"
      }
    },
    "Ethics": {
      "type": "object",
      "description": "Attribute bonuses for Ethics class",
      "additionalProperties": {
        "type": "integer"
      }
    },
    "Science": {
      "type": "object",
      "description": "Attribute bonuses for Science class",
      "additionalProperties": {
        "type": "integer"
      }
    },
    "Club Activities": {
      "type": "object",
      "description": "Attribute bonuses for Club Activities",
      "additionalProperties": {
        "type": "integer"
      }
    },
    "Power Theory": {
      "type": "object",
      "description": "Attribute bonuses for Power Theory class",
      "additionalProperties": {
        "type": "integer"
      }
    },
    "Mathematics": {
      "type": "object",
      "description": "Attribute bonuses for Mathematics class",
      "additionalProperties": {
        "type": "integer"
      }
    },
    "Physical Education": {
      "type": "object",
      "description": "Attribute bonuses for Physical Education class",
      "additionalProperties": {
        "type": "integer"
      }
    },
    "Literature": {
      "type": "object",
      "description": "Attribute bonuses for Literature class",
      "additionalProperties": {
        "type": "integer"
      }
    },
    "Power Applications": {
      "type": "object",
      "description": "Attribute bonuses for Power Applications class",
      "additionalProperties": {
        "type": "integer"
      }
    },
    "Social Studies": {
      "type": "object",
      "description": "Attribute bonuses for Social Studies class",
      "additionalProperties": {
        "type": "integer"
      }
    },
    "Elective": {
      "type": "object",
      "description": "Attribute bonuses for Elective class",
      "additionalProperties": {
        "type": "integer"
      }
    },
    "Free Study": {
      "type": "object",
      "description": "Attribute bonuses for Free Study",
      "additionalProperties": {
        "type": "integer"
      }
    }
  }
}