{
  "Power Control": {
    "power_stat": 2
  },
  "History of Powers": {
    "intellect": 1,
    "charisma": 1
  },
  "Combat Training": {
    "power_stat": 1,
    "dexterity": 1
  },
  "Ethics": {
    "charisma": 2
  },
  "Science": {
    "intellect": 2
  },
  "Club Activities": {
    "power_stat": 1,
    "charisma": 1
  },
  "Power Theory": {
    "intellect": 2
  },
  "Mathematics": {
    "intellect": 2
  },
  "Physical Education": {
    "dexterity": 2
  },
  "Literature": {
    "intellect": 1,
    "charisma": 1
  },
  "Power Applications": {
    "power_stat": 1,
    "intellect": 1
  },
  "Social Studies": {
    "charisma": 2
  },
  "Elective": {
    "intellect": 1,
    "charisma": 1
  },
  "Free Study": {
    "intellect": 1
  }
}